[
  {
    "id": "ko_k1_0001",
    "language": "ko",
    "lemma": "나",
    "pos": "pronoun",
    "sense": "i_informal",
    "gloss_ja": "私（普通形）",
    "level": "K1",
    "tier": "core",
    "rank": 1,
    "tags": [
      "daily_life"
    ],
    "allow_inflection": false,
    "introduced_from": null,
    "introduced_to": null,
    "target_exposures": null,
    "forms": [],
    "notes": null,
    "category": "reference",
    "confidence": "high"
  },
  {
    "id": "ko_k1_0002",
    "language": "ko",
    "lemma": "저",
    "pos": "pronoun",
    "sense": "i_humble",
    "gloss_ja": "私（謙譲）",
    "level": "K1",
    "tier": "core",
    "rank": 2,
    "tags": [
      "daily_life",
      "communication"
    ],
    "allow_inflection": false,
    "introduced_from": null,
    "introduced_to": null,
    "target_exposures": null,
    "forms": [],
    "notes": null,
    "category": "reference",
    "confidence": "high"
  },
  {
    "id": "ko_k1_0003",
    "language": "ko",
    "lemma": "너",
    "pos": "pronoun",
    "sense": "you_informal",
    "gloss_ja": "あなた（親しい相手）",
    "level": "K1",
    "tier": "core",
    "rank": 3,
    "tags": [
      "daily_life"
    ],
    "allow_inflection": false,
    "introduced_from": null,
    "introduced_to": null,
    "target_exposures": null,
    "forms": [],
    "notes": "해요체で安易に相手へ使わない。主に親しい人物関係に限定。",
    "category": "reference",
    "confidence": "high"
  },
  {
    "id": "ko_k1_0004",
    "language": "ko",
    "lemma": "우리",
    "pos": "pronoun",
    "sense": "we",
    "gloss_ja": "私たち",
    "level": "K1",
    "tier": "core",
    "rank": 4,
    "tags": [
      "daily_life"
    ],
    "allow_inflection": false,
    "introduced_from": null,
    "introduced_to": null,
    "target_exposures": null,
    "forms": [],
    "notes": "韓国語の우리 집等の共有・所属表現も許可。",
    "category": "reference",
    "confidence": "high"
  },
  {
    "id": "ko_k1_0005",
    "language": "ko",
    "lemma": "여기",
    "pos": "pronoun",
    "sense": "here",
    "gloss_ja": "ここ",
    "level": "K1",
    "tier": "core",
    "rank": 5,
    "tags": [
      "daily_life"
    ],
    "allow_inflection": false,
    "introduced_from": null,
    "introduced_to": null,
    "target_exposures": null,
    "forms": [],
    "notes": null,
    "category": "reference",
    "confidence": "high"
  },
  {
    "id": "ko_k1_0006",
    "language": "ko",
    "lemma": "거기",
    "pos": "pronoun",
    "sense": "there_near_listener",
    "gloss_ja": "そこ",
    "level": "K1",
    "tier": "core",
    "rank": 6,
    "tags": [
      "daily_life"
    ],
    "allow_inflection": false,
    "introduced_from": null,
    "introduced_to": null,
    "target_exposures": null,
    "forms": [],
    "notes": null,
    "category": "reference",
    "confidence": "high"
  },
  {
    "id": "ko_k1_0007",
    "language": "ko",
    "lemma": "저기",
    "pos": "pronoun",
    "sense": "there_over_there",
    "gloss_ja": "あそこ",
    "level": "K1",
    "tier": "core",
    "rank": 7,
    "tags": [
      "daily_life"
    ],
    "allow_inflection": false,
    "introduced_from": null,
    "introduced_to": null,
    "target_exposures": null,
    "forms": [],
    "notes": null,
    "category": "reference",
    "confidence": "high"
  },
  {
    "id": "ko_k1_0008",
    "language": "ko",
    "lemma": "이것",
    "pos": "pronoun",
    "sense": "this_thing",
    "gloss_ja": "これ",
    "level": "K1",
    "tier": "core",
    "rank": 8,
    "tags": [
      "daily_life"
    ],
    "allow_inflection": false,
    "introduced_from": null,
    "introduced_to": null,
    "target_exposures": null,
    "forms": [],
    "notes": null,
    "category": "reference",
    "confidence": "high"
  },
  {
    "id": "ko_k1_0009",
    "language": "ko",
    "lemma": "그것",
    "pos": "pronoun",
    "sense": "that_thing",
    "gloss_ja": "それ",
    "level": "K1",
    "tier": "core",
    "rank": 9,
    "tags": [
      "daily_life"
    ],
    "allow_inflection": false,
    "introduced_from": null,
    "introduced_to": null,
    "target_exposures": null,
    "forms": [],
    "notes": null,
    "category": "reference",
    "confidence": "high"
  },
  {
    "id": "ko_k1_0010",
    "language": "ko",
    "lemma": "저것",
    "pos": "pronoun",
    "sense": "that_thing_over_there",
    "gloss_ja": "あれ",
    "level": "K1",
    "tier": "core",
    "rank": 10,
    "tags": [
      "daily_life"
    ],
    "allow_inflection": false,
    "introduced_from": null,
    "introduced_to": null,
    "target_exposures": null,
    "forms": [],
    "notes": null,
    "category": "reference",
    "confidence": "high"
  },
  {
    "id": "ko_k1_0011",
    "language": "ko",
    "lemma": "누구",
    "pos": "pronoun",
    "sense": "who",
    "gloss_ja": "誰",
    "level": "K1",
    "tier": "core",
    "rank": 11,
    "tags": [
      "daily_life",
      "communication"
    ],
    "allow_inflection": false,
    "introduced_from": null,
    "introduced_to": null,
    "target_exposures": null,
    "forms": [],
    "notes": null,
    "category": "reference",
    "confidence": "high"
  },
  {
    "id": "ko_k1_0012",
    "language": "ko",
    "lemma": "뭐",
    "pos": "pronoun",
    "sense": "what_colloquial",
    "gloss_ja": "何（口語）",
    "level": "K1",
    "tier": "core",
    "rank": 12,
    "tags": [
      "daily_life",
      "communication"
    ],
    "allow_inflection": false,
    "introduced_from": null,
    "introduced_to": null,
    "target_exposures": null,
    "forms": [],
    "notes": null,
    "category": "reference",
    "confidence": "high"
  },
  {
    "id": "ko_k1_0013",
    "language": "ko",
    "lemma": "무엇",
    "pos": "pronoun",
    "sense": "what",
    "gloss_ja": "何",
    "level": "K1",
    "tier": "core",
    "rank": 13,
    "tags": [
      "daily_life",
      "communication"
    ],
    "allow_inflection": false,
    "introduced_from": null,
    "introduced_to": null,
    "target_exposures": null,
    "forms": [],
    "notes": null,
    "category": "reference",
    "confidence": "high"
  },
  {
    "id": "ko_k1_0014",
    "language": "ko",
    "lemma": "어디",
    "pos": "pronoun",
    "sense": "where",
    "gloss_ja": "どこ",
    "level": "K1",
    "tier": "core",
    "rank": 14,
    "tags": [
      "daily_life",
      "communication"
    ],
    "allow_inflection": false,
    "introduced_from": null,
    "introduced_to": null,
    "target_exposures": null,
    "forms": [],
    "notes": null,
    "category": "reference",
    "confidence": "high"
  },
  {
    "id": "ko_k1_0015",
    "language": "ko",
    "lemma": "언제",
    "pos": "adverb",
    "sense": "when",
    "gloss_ja": "いつ",
    "level": "K1",
    "tier": "core",
    "rank": 15,
    "tags": [
      "daily_life",
      "communication"
    ],
    "allow_inflection": false,
    "introduced_from": null,
    "introduced_to": null,
    "target_exposures": null,
    "forms": [],
    "notes": "언제 가요?の副詞用法のみ。언제가の代名詞用法は未登録。",
    "category": "reference",
    "confidence": "high"
  },
  {
    "id": "ko_k1_0016",
    "language": "ko",
    "lemma": "왜",
    "pos": "adverb",
    "sense": "why",
    "gloss_ja": "なぜ",
    "level": "K1",
    "tier": "core",
    "rank": 16,
    "tags": [
      "daily_life",
      "communication"
    ],
    "allow_inflection": false,
    "introduced_from": null,
    "introduced_to": null,
    "target_exposures": null,
    "forms": [],
    "notes": null,
    "category": "reference",
    "confidence": "high"
  },
  {
    "id": "ko_k1_0017",
    "language": "ko",
    "lemma": "어떻게",
    "pos": "adverb",
    "sense": "how",
    "gloss_ja": "どのように",
    "level": "K1",
    "tier": "core",
    "rank": 17,
    "tags": [
      "daily_life",
      "communication"
    ],
    "allow_inflection": false,
    "introduced_from": null,
    "introduced_to": null,
    "target_exposures": null,
    "forms": [],
    "notes": null,
    "category": "reference",
    "confidence": "high"
  },
  {
    "id": "ko_k1_0018",
    "language": "ko",
    "lemma": "어느",
    "pos": "determiner",
    "sense": "which",
    "gloss_ja": "どの",
    "level": "K1",
    "tier": "core",
    "rank": 18,
    "tags": [
      "daily_life",
      "communication"
    ],
    "allow_inflection": false,
    "introduced_from": null,
    "introduced_to": null,
    "target_exposures": null,
    "forms": [],
    "notes": null,
    "category": "reference",
    "confidence": "high"
  },
  {
    "id": "ko_k1_0019",
    "language": "ko",
    "lemma": "같이",
    "pos": "adverb",
    "sense": "together",
    "gloss_ja": "一緒に",
    "level": "K1",
    "tier": "core",
    "rank": 19,
    "tags": [
      "daily_life"
    ],
    "allow_inflection": false,
    "introduced_from": null,
    "introduced_to": null,
    "target_exposures": null,
    "forms": [],
    "notes": "共同動作のみ。N같이の比況・助詞用法は未登録。",
    "category": "reference",
    "confidence": "high"
  },
  {
    "id": "ko_k1_0020",
    "language": "ko",
    "lemma": "모두",
    "pos": "adverb",
    "sense": "all_together",
    "gloss_ja": "みんなで・全部",
    "level": "K1",
    "tier": "core",
    "rank": 20,
    "tags": [
      "daily_life"
    ],
    "allow_inflection": false,
    "introduced_from": null,
    "introduced_to": null,
    "target_exposures": null,
    "forms": [],
    "notes": "副詞用法のみ。모두가の名詞用法はこのエントリでは許可しない。",
    "category": "reference",
    "confidence": "high"
  },
  {
    "id": "ko_k1_0021",
    "language": "ko",
    "lemma": "사람",
    "pos": "noun",
    "sense": "person",
    "gloss_ja": "人",
    "level": "K1",
    "tier": "core",
    "rank": 21,
    "tags": [
      "daily_life",
      "family"
    ],
    "allow_inflection": false,